{
  "schema_version": "1.0",
  "policy_pack_version": "2026.07",
  "reviewed_at": "2026-07-13",
  "minimum_android_target_sdk": 35,
  "minimum_wear_target_sdk": 34,
  "fail_on_warnings": false,
  "fail_on_manual": false,
  "fail_on_unavailable": true,
  "approved_signing_identities": [],
  "trusted_evidence_issuers": [],
  "production_placeholder_patterns": [
    "localhost",
    "127.0.0.1",
    "0.0.0.0",
    "example.com",
    "changeme"
  ],
  "required_manual_evidence": [
    "store_listing_review",
    "production_smoke_test",
    "release_owner_approval",
    "rollback_plan"
  ],
  "required_public_urls": [
    "privacy_policy",
    "support"
  ]
}
